{
  "version": "0.1.0",
  "id": "bench_900_storage",
  "type": "seating",
  "dimensions_mm": {
    "width": 900,
    "depth": 520,
    "height": 450
  },
  "anchor": "floor_back_left",
  "placement": "floor",
  "clearances": {
    "front_mm": 350,
    "sides_mm": 20,
    "above_mm": 50
  },
  "visual": {
    "glb_path": "assets/bench_900.glb",
    "collision_proxy": "UCX_bench_900",
    "material_slots": ["ply_body", "seat_cushion"]
  },
  "manufacturing": {
    "fusion_template": "bench_v1",
    "plywood_thickness_mm": 15,
    "weight_kg": 28,
    "hardware": ["hinges_2x"]
  },
  "rules": {
    "cnc_eligible": true,
    "build_difficulty": "easy",
    "service_access": ["top_panel"]
  }
}
